HotelName,HotelName,PriceRange,AddressLocality,AddressLocality,AddressLocality,Time,Rating
0,1,2,3,6,7,10,11.0
Grand Plaza Hanoi Hotel,Grand Plaza Hanoi Hotel,Price range: $100 - $535,Trung Hoa - Nhan Chinh - National Convention Center,Trung Hoa - Nhan Chinh - National Convention Center,"117 Tran Duy Hung, Cau Giay District, Trung Hoa - Nhan Chinh - National Convention Center, Hanoi, Vietnam",307,4.7100977199
Harbour View Hotel,Harbour View Hotel,Price range: $90 - $160,City Center / Sat Market,City Center / Sat Market,"12 Tran Phu Street, City Center / Sat Market, Haiphong, Vietnam",61,4.4426229508
Best Western Pearl River Hotel,Best Western Pearl River Hotel,Price range: $80 - $250,Rao Bridge,Rao Bridge,"Km 8 Pham Van Dong Street, Duong Kinh Distict, Rao Bridge, Haiphong, Vietnam",139,4.0287769784
Bhaya Cruises,Bhaya Cruises,Price range: $323 - $912,Hanoi,"Hoan Kiem,","Unit 507, International Centre, 17 Ngo Quyen St.,",332,4.6897590361
Hoang Yen Hotel 1,Hoang Yen Hotel 1,Price range: $60 - $112,Quy Nhon,Quy Nhon,"No.5, An Duong Vuong Street, City Beach, Quy Nhon (Binh Dinh), Vietnam",368,4.3913043478
Majestic Hotel,Majestic Hotel,Price range: $165 - $360,District 1 - Riverside,District 1 - Riverside,"1 Dong Khoi Street, District 1, District 1 - Riverside, Ho Chi Minh City, Vietnam",177,4.9774011299
Park Hyatt Hotel,Park Hyatt Hotel,Price range: $330 - $890,District 1 - Dong Khoi / Nguyen Hue,District 1 - Dong Khoi / Nguyen Hue,"2 Lam Son Square, District 1 - Dong Khoi / Nguyen Hue, Ho Chi Minh City, Vietnam",263,4.8897338403
Victoria Can Tho Resort,Victoria Can Tho Resort,Price range: $130 - $210,Can Tho,Can Tho,"Cai Khe Ward, Cai Khe, Can Tho, Vietnam",283,4.8586572438
Seagull Hotel,Seagull Hotel,Price range: $80 - $190,Quy Nhon,Quy Nhon,"489 An Duong Vuong street, City Beach, Quy Nhon (Binh Dinh), Vietnam",182,4.7417582418
Sunny Mountain Hotel,Sunny Mountain Hotel,Price range: $25 - $95,Market Area,Market Area,"010 Muong Hoa - Cau May, Market Area, Sapa (Lao Cai), Vietnam",113,4.9115044248
Halong Bay Private Day trip,Halong Bay Private Day trip,Price range: $75 - $275,,,,123,4.4471544715
The Nam Hai Resort,The Nam Hai Resort,Price range: $830 - $1500,Beach Front,Beach Front,"Hamlet 1, Dien Duong Village, Beach Front, Hoi An, Vietnam",129,4.5271317829
Saigon Quy Nhon Hotel,Saigon Quy Nhon Hotel,Price range: $70 - $450,Quy Nhon,Quy Nhon,"24 Nguyen Hue St, Qui Nhon City, City Beach, Quy Nhon (Binh Dinh), Vietnam",135,4.6555555556
Hyatt Regency Danang Resort and Spa,Hyatt Regency Danang Resort and Spa,Price range: $240 - $1200,Da Nang,Da Nang,"Hoa Hai Ward, Ngu Hanh Son District, Non Nuoc Beach, Danang, Vietnam",182,4.2527472527
Imperial Hotel Hue,Imperial Hotel Hue,Price range: $100 - $475,Hue City,Hue City,"8 Hung Vuong Street, Hue City, Hue, Vietnam",198,4.9191919192
Novotel Nha Trang Hotel,Novotel Nha Trang Hotel,Price range: $120 - $750,Nha Trang,Nha Trang,"50 Tran Phu Street , Beach Front / Central Tran Phu, Nha Trang, Vietnam",390,4.2205128205
Emperor Cruise,Emperor Cruise,Price range: $640 - $1900,Hanoi,"Hoan Kiem,","Unit 507, International Centre, 17 Ngo Quyen St.,",365,4.9630136986
Saigon Halong Hotel,Saigon Halong Hotel,Price range: $45 - $135,Halong / Bai Chay,Halong / Bai Chay,"Ha Long Road, Bai Chay Beach, Quang Ninh Province, Halong / Bai Chay, Halong, Vietnam",295,4.9389830508
Bamboo Sapa Hotel,Bamboo Sapa Hotel,Price range: $60 - $90,Sapa Surrounds,Sapa Surrounds,"018 Muong Hoa Street, Sapa Surrounds, Sapa (Lao Cai), Vietnam",188,4.4042553191
Yen Nhi Ninh Binh Hotel,Yen Nhi Ninh Binh Hotel,Price range: $30 - $45,Tam Coc - Bich Dong Caves,Tam Coc - Bich Dong Caves,"Ninh Hai, Hoa Lu District, Tam Coc - Bich Dong Caves, Ninh Binh, Vietnam",295,4.6203389831
President Cruise,President Cruise,Price range: $387 - $5581,Hanoi,"Hoan Kiem,","Unit 507, International Centre, 17 Ngo Quyen St.,",120,4.3916666667
Grand Hotel Saigon,Grand Hotel Saigon,Price range: $125 - $260,District 1 - Riverside,District 1 - Riverside,"8 Dong Khoi Street, District 1, District 1 - Riverside, Ho Chi Minh City, Vietnam",64,4.7578125
Heritage Line Violet,Heritage Line Violet,Price range: $628 - $1442,Hanoi,"Hoan Kiem,","Unit 507, International Centre, 17 Ngo Quyen St.,",191,4.4895287958
Chau Long Sapa II Hotel,Chau Long Sapa II Hotel,Price range: $65 - $140,Market Area,Market Area,"24 Dong Loi Street, Market Area, Sapa (Lao Cai), Vietnam",108,4.6666666667
The Imperial Hotel Vung Tau,The Imperial Hotel Vung Tau,Price range: $312 - $541,Con Dao,Con Dao,"159 Thuy Van Street, Thuy Van Beach, Vung Tau, Vietnam",153,4.8692810458
Private Bhaya Legend 1 cabin,Private Bhaya Legend 1 cabin,Price range: $ - $ 1472,,,,88,4.2386363636
Private Bhaya Legend 3 cabins,Private Bhaya Legend 3 cabins,Price range: $ - $ 2559,,,,349,4.4641833811
Ho Tram Beach Resort Spa,Ho Tram Beach Resort Spa,Price range: $130 - $670,Vung Tau,Vung Tau,"Phuoc Thuan, Xuyen Moc District, Ho Tram Beach, Vung Tau, Vietnam",239,4.2845188285
Novotel Ha Long Bay Hotel,Novotel Ha Long Bay Hotel,Price range: $90 - $140,Halong / Bai Chay,Halong / Bai Chay,"Ha Long Road, Bai Chay Ward, Halong / Bai Chay, Halong, Vietnam",351,4.9601139601
Sea Links Beach Hotel,Sea Links Beach Hotel,Price range: $147 - $331,Phan Thiet,Phan Thiet,"Km 9, Nguyen Thong St., Phu Hai Ward, Central Mui Ne Beach, Phan Thiet, Vietnam",368,4.25
Halong Plaza Hotel,Halong Plaza Hotel,Price range: $70 - $200,Halong / Bai Chay,Halong / Bai Chay,"8 Halong Road, Baichay , Halong / Bai Chay, Halong, Vietnam",360,4.0888888889
Intercontinental West Lake Hotel,Intercontinental West Lake Hotel,Price range: $150 - $280,Tay Ho District - West Lake / Nghi Tam,Tay Ho District - West Lake / Nghi Tam,"1A Nghi Tam, Tay Ho, Tay Ho District - West Lake / Nghi Tam, Hanoi, Vietnam",237,4.3206751055
Hera Cruises,Hera Cruises,Price range: $620 - $1371,Hanoi,"Hoan Kiem,","Unit 507, International Centre, 17 Ngo Quyen St.,",236,4.2584745763
Heritage Line Ginger,Heritage Line Ginger,Price range: $550 - $866,Hanoi,"Hoan Kiem,","Unit 507, International Centre, 17 Ngo Quyen St.,",87,4.4367816092
Silk Path Hotel,Silk Path Hotel,Price range: $90 - $170,Hoan Kiem District - Ha Noi Cathedral,Hoan Kiem District - Ha Noi Cathedral,"195-199 Hang Bong , Hoan Kiem District - Ha Noi Cathedral, Hanoi, Vietnam",125,4.088
