name,other,restaurant name,rating,rating,other,additional informations,phone number,address,location,other,rating,rating,rating,rating,rating,reviews count,other,rating,additional informations,other,address,website,phone number
"The Dome Milano - La Terrazza Restaurant - Milano, Citta Metropolitana di Milano | OpenTable",See all 503 photos,The Dome Milano - La Terrazza,,,843 Reviews,"Located on the 7th floor of the building, The Dome Rooftop is a unique environment, characterised by an enveloping and vibrant atmosphere.   Through breakfasts, lunches, aperitifs and dinners, clients can spend pleasant and relaxing moments during their day, immersed into suggestive natural elements.",345 150 7992,"Via Giuseppe Mazzini 2,  Milano, Citta Metropolitana di Milano 20123",,What 843 people are saying,4.3,3.9,4.0,4.5,3.5,844 Reviews,"DK   DeryaK   London          1 review                              5.0           1 review    Dined 3 days ago     Overall  5    Food  5    Service  5    Ambience  5      It was amazing. The pistachio croissant was delicious. The pasta and the rice wauw!!                     Is this helpful?          Report        CR   ChiaraR   Milan          1 review                              5.0           1 review    Dined 4 days ago     Overall  5    Food  5    Service  5    Ambience  5      Bello elegante ottimo servizio ,una bellissima atmosfera e cibo davvero ottimo e di alta qualità                     Is this helpful?          Report        GM   GretaM   Milan          1 review                              3.0           1 review    Dined 6 days ago     Overall  3    Food  5    Service  4    Ambience  1      La terrazza era chiusa per lavori… ma nessuno ci ha avvisate, abbiamo dovuto scoprirlo quando siamo arrivate! assurdo!                     Is this helpful?          Report        SI   SIMONAB   Milan          1 review                              5.0           1 review    Dined on January 6, 2024     Overall  5    Food  4    Service  5    Ambience  5      Personale cordiale e preparato. Nel menù non è prevista una grande scelta, ma tutto molto buono. Vista pazzesca!!!                     Is this helpful?          Report        CC   ChiaraC   Milan          1 review                              4.0           1 review    Dined on January 6, 2024     Overall  4    Food  5    Service  5    Ambience  5      Colazione abbondante e di qualità in locale tranquillo e accogliente. Peccato per il cielo grigio e nebbioso che non ha permesso di godere del panorama                     Is this helpful?          Report        MM   MegiM   Milan          1 review                              4.0           1 review    Dined on January 5, 2024     Overall  4    Food  4    Service  3    Ambience  4      Being asked to move from our table (with a view) because of somebody’s mistake wasn’t nice. We went there because of the view. We were moved to another table (not same view) and our previous table wasn’t even occupied for at least 1;30h . For everything else it was great, the drinks, the vibe and the people                     Is this helpful?          Report        SB   SimoneB   Milan          1 review                              3.0           1 review    Dined on January 5, 2024     Overall  3    Food  3    Service  3    Ambience  4      Locale molto bello peccato con la pioggia piova dentro e vedere il cameriere con il moccio sotto i tavoli delle persone è un po’ bruttino                     1 person found this helpful          Report        ME   ManlioE   Milan          1 review                              5.0           1 review    Dined on January 5, 2024     Overall  5    Food  3    Service  5    Ambience  5      Terrazza molto bella, arredata con stile e con vista eccezionale.                     1 person found this helpful          Report        GM   GianlucaM   Milan          1 review                              5.0           1 review    Dined on January 5, 2024     Overall  5    Food  4    Service  5    Ambience  5      Bel posto vista bellissima, servizio perfetto!!!!!                     1 person found this helpful          Report        GB   GiadaB   Milan          1 review                              5.0           1 review    Dined on January 4, 2024     Overall  5    Food  4    Service  4    Ambience  5      Locale ed atmosfera molto suggestiva ed accogliente. Ritornerò sicuramente                                    Is this helpful?          Report        FM   FabianaM   Milan          1 review                              5.0           1 review    Dined on January 4, 2024     Overall  5    Food  4    Service  5    Ambience  5      Bellissimo posto con vista incantevole su piazza Duomo. Atmosfera tranquilla e cibo buono. Ideale per una pausa pranzo o un caffè. Dettagli molto curati, servizio impeccabile. Consiglio!                                    1 person found this helpful          Report        AC   AlessiaC   Milan          1 review                              5.0           1 review    Dined on January 1, 2024     Overall  5    Food  5    Service  5    Ambience  5      Posto e vista stupendi. 
Rapporto qualità prezzo ottimo.                     Is this helpful?          Report        MB   MattiaB   Milan          1 review                              5.0           1 review    Dined on January 1, 2024     Overall  5    Food  5    Service  5    Ambience  5      Posto molto suggestivo e di classe. Musica alta il giusto e drink spettacolari!                     Is this helpful?          Report        OT   OpenTable Diner   Milan          2 reviews                              3.0           2 reviews    Dined on January 1, 2024     Overall  3    Food  2    Service  2    Ambience  5      You are paying for the beautiful view, the food and the service is way too expensive for the quality that you get..                     1 person found this helpful          Report        OT   OpenTable Diner   Manchester          2 reviews                              2.0           2 reviews    Dined on January 1, 2024     Overall  2    Food  1    Service  1    Ambience  3      A lot to pay just for the view! And if you don’t get sat at the window then there’s no point! Good was poor quality!                                    1 person found this helpful          Report        MD   MaraD   Milan          1 review                              5.0           1 review    Dined on December 31, 2023     Overall  5    Food  5    Service  5    Ambience  5      Eccellente, consigliato. Atmosfera super. Cibo ottimo.                     Is this helpful?          Report        LR   LenaR   Milan          1 review                              3.0           1 review    Dined on December 30, 2023     Overall  3    Food  2    Service  3    Ambience  5      Die Aussicht war super, sowie die Einrichtung. Leider war das Essen sehr enttäuschend, da es fad und ohne Salz war. Zudem waren die Portion zu klein für den Preis. Das Personal war sehr hektisch, es erinnerte sehr an Massenproduktion, da sie immer wieder schauten, ob man schon fertig ist und Platz für neue Gäste ist.                     Is this helpful?          Report        R   Rodolfo   Mexico City          14 reviews    vip                             3.0           14 reviews    Dined on December 29, 2023     Overall  3    Food  3    Service  3    Ambience  2      No están preparados, te hacen esperar mucho y la vista no es buena                     1 person found this helpful          Report        M   brunaM   Milan          1 review                              4.0           1 review    Dined on December 28, 2023     Overall  4    Food  4    Service  3    Ambience  5      Stupenda location affacciata sul duomo. Ambiente natalizio molto accogliente. Servizio non all’altezza delle pretese. Bagno sporco. Bicchieri sporchi abbandonati sui tavoli e su vari appoggi.                     Is this helpful?          Report        MB   MirellaB   Milan          1 review                              5.0           1 review    Dined on December 28, 2023     Overall  5    Food  5    Service  5    Ambience  5      maghca atmosfera in questo locale con allestimenti bellissimi … 
personale attento e servizio veloce.

consiglio di prenotare                     Is this helpful?          Report        OT   OpenTable Diner   London          3 reviews                              4.0           3 reviews    Dined on December 28, 2023     Overall  4    Food  4    Service  5    Ambience  5      Little bit on the pricier side but understandable given location. Happy with overall meal and service.                     Is this helpful?          Report        MM   MatteoM   Milan          1 review                              5.0           1 review    Dined on December 27, 2023     Overall  5    Food  4    Service  4    Ambience  5      Nulla da dire sulla location. Lodi particolari a chi ha pensato l’allestimento Natalizio. Cocktail ottimi. Peccato davvero la misera “fornitura” di finger food che accompagnava i cocktail.                     Is this helpful?          Report        NL   NoemiL   London          1 review                              2.0           1 review    Dined on December 27, 2023     Overall  2    Food  1    Service  1    Ambience  3      Abbiamo chiesto se un cocktail avesse il ghiaccio e non lo abbiamo preso perché la risposta è stata affermativa, allora ordiniamo un estratto che ci viene portato col ghiaccio.. senza parole                     Is this helpful?          Report        TI   TatyItaly   London          2 reviews                              5.0           2 reviews    Dined on December 27, 2023     Overall  5    Food  4    Service  5    Ambience  4      Allestimento scenografico.
Vista su Milano.
Staff cordiale e simpatico.                     Is this helpful?          Report        FM   FedericaM   Milan          1 review                              5.0           1 review    Dined on December 26, 2023     Overall  5    Food  5    Service  5    Ambience  5      Vista spettacolare ambiente elegante servizio ottimo                     Is this helpful?          Report        AC   AnguiC   Central Coast          3 reviews                              2.0           3 reviews    Dined on December 26, 2023     Overall  2    Food  2    Service  1    Ambience  2      Service was extremely slow, the menu was very limited in options. Nothing special and we ordered 8 dishes. There is a service charge per person on top of the cost which is high for the value and quantity of food. This restaurant is overrated.                     Is this helpful?          Report        ND   NDam   New York City          2 reviews                              3.0           2 reviews    Dined on December 25, 2023     Overall  3    Food  3    Service  2    Ambience  3      While the place has a cute vibe and decent portion sizes, my experience was less than stellar. The promised Duomo view didn't quite live up to expectations, and the overall view was just okay. Service was frustratingly slow, though the staff were friendly. The saving graces were the attractive decor and the fact that it's open. If you do visit, perhaps stick to the recommended focaccia and salmon tartare to avoid disappointment.                     Is this helpful?          Report        DA   DANIELET   Milan          1 review                              5.0           1 review    Dined on December 24, 2023     Overall  5    Food  5    Service  5    Ambience  5      Locale eccezionale con vista, servizio e proposte favolose. Super consigliato per chi vuole avere una esperienza fuori dalla normalità.                     Is this helpful?          Report        MA   MARZIAM   Milan          1 review                              5.0           1 review    Dined on December 24, 2023     Overall  5    Food  4    Service  4    Ambience  5      Location molto carina e suggestiva, con vista sul Duomo di Milano.
Piatti nella media con qualche originalità.
Personale molto gentile                                             Is this helpful?          Report        AR   AndreaR   Milan          1 review                              4.0           1 review    Dined on December 24, 2023     Overall  4    Food  4    Service  5    Ambience  5      Location fantastica, personale gentile e disponibile, buona scelta nel menu’, rapporto qualità prezzo su cui influisce la location di cui sopra (estremamente curata anche negli arredi).                     Is this helpful?          Report        MC   MariannaC   Milan          1 review                              5.0           1 review    Dined on December 24, 2023     Overall  5    Food  5    Service  5    Ambience  5      E’ stato tutto meraviglioso, atmosfera natalizia stupenda,                     Is this helpful?          Report        VC   ValentinaC   Milan          1 review                              3.0           1 review    Dined on December 24, 2023     Overall  3    Food  2    Service  5    Ambience  4      La location molto bella e il servizio davvero top. Il cibo di qualità mediocre e il prezzo eccessivo per la qualità mediocre del cibo                     Is this helpful?          Report        OT   OpenTable Diner   Milan          1 review                              1.0           1 review    Dined on December 23, 2023     Overall  1    Food  1    Service  1    Ambience  1      Bellissima vista, ma ambiente che non ho apprezzato perché non ne ho percepito l’identità, la personalità.
Da turista, non da imbruttito.
Tavolini e sedie anonimi, mi ha deluso, non ci tornerò.                     Is this helpful?          Report        OT   OpenTable Diner   Milan          1 review                              5.0           1 review    Dined on December 23, 2023     Overall  5    Food  3    Service  4    Ambience  5      Un aperitivo natalizio in un’atmosfera veramente fantastica. Cortesissimo e disponibile il personale, la possibilità di un drink vista Madonnina e’ qualcosa da non perdere.                     Is this helpful?          Report        BS   BarbaraS   Milan          2 reviews                              5.0           2 reviews    Dined on December 23, 2023     Overall  5    Food  5    Service  5    Ambience  5      È un locale davvero bellissimo!
Ma dovrebbero offrire durante l’aperitivo qualcosa in più.
Il resto nulla da dire.                     Is this helpful?          Report        F   Flywally   Orlando          5 reviews                              5.0           5 reviews    Dined on December 23, 2023     Overall  5    Food  5    Service  5    Ambience  5      We were greeted warmly by the host at the front door and provided instructions and clearance to use elevators to the restaurant 7 floors up. We were immediately impressed with the views and imaginative design and decor through out the restaurant! The staff was friendly and helpful. Speaking English was no problem. We started with cocktails and wine which everyone enjoyed. The food was good. We had lasagne, meatballs, flatbread and steamed pizza.
Each was tasty and the serving sizes were ideal. We will definitely return and enjoy the same.                     Is this helpful?          Report        AB   AlessandroB   Milan          1 review                              1.0           1 review    Dined on December 22, 2023     Overall  1    Food  2    Service  1    Ambience  3      SERVIZIO INESISTENTE ED INACCETTABILE, QUALITÁ SCADENTE                     Is this helpful?          Report        A   Aliceroman   New York City          2 reviews                              3.0           2 reviews    Dined on December 22, 2023     Overall  3    Food  3    Service  3    Ambience  4      Non entusiasmante, mi sarei aspettata di meglio, la cioccolata non così buona e personale non molto gentile, molto costoso.. potrebbe costare così se fosse gestito meglio                     Is this helpful?          Report        DB   DanielaB   New York City          1 review                              3.0           1 review    Dined on December 22, 2023     Overall  3    Food  3    Service  2    Ambience  5      Abbiamo atteso lungamente per essere serviti, non passava mai nessuno a chiedere se avevamo bisogno o se volevamo ordinare altri. Atmosfera bella ma nulla di eclatante. Eclatante invece il prezzo rispetto alla consumazione.                     Is this helpful?          Report        M   Mike   Miami          8 reviews                              5.0           8 reviews    Dined on December 22, 2023     Overall  5    Food  4    Service  5    Ambience  5      Ottima location e servizio. Vista Duomo laterale e ambiente elegante                     Is this helpful?          Report",How is The Dome Milano - La Terrazza restaurant rated?,The Dome Milano - La Terrazza is rated 4.3 stars by 843 OpenTable diners.,Is The Dome Milano - La Terrazza currently accepting reservations?,"Via Giuseppe Mazzini 2,  Milano, Citta Metropolitana di Milano 20123",http://thedomemilano.com/,
"Bruno alla Lungaretta Restaurant - Rome, LA | OpenTable",See all 5 photos,Bruno alla Lungaretta,1.0,1.0,1 Review,,,"68/70 Via della Lungaretta,  Rome, LA 00153",Trastevere,,,,,,,,,How is Bruno alla Lungaretta restaurant rated?,Bruno alla Lungaretta is rated 1 stars by 1 OpenTable diners.,Is Bruno alla Lungaretta currently accepting reservations?,"68/70 Via della Lungaretta,  Rome, LA 00153",,
