name,other,restaurant name,rating,rating,other,additional informations,phone number,address,location,other,rating,rating,rating,rating,rating,reviews count,other,rating,additional informations,other,address,website,phone number
"Hard Rock Cafe - Rome Restaurant - Rome, LA | OpenTable",See all 348 photos,Hard Rock Cafe - Rome,4.6,4.6,1223 Reviews,"Placed in the middle of the elegant street of the Roman “Dolce Vita”, Hard Rock Cafe Rome is an exclusive location for authentic experiences filled with energy and great vibes. Do Like the Romans Do! While dining at our world-class fine restaurant, you'll find not just amazing meals to fit every appetite, but also wide windows on the Roman world. Hard Rock Cafe Rome is the ultimate spot for people watching, a quintessential part of Roman culture. So when in Rome, whether improving your wardrobe or seeking out la dolce vita, visit the Hard Rock Cafe Rome for everything an emperor would desire. The location is also a true music history museum thanks to the original memorabilia on display all around the venue. It is possible to admire a classic dress by David Bowie, a Fender telecaster guitar signed by Bruce Springsteen, the grey trench from John Lennon during his hyper-political period in the ’70s and an amazing patchwork suit worn by Jimi Hendrix during the Isle of Wight festival.",06 4203 0501,"Via Vittorio Veneto 62A/B,  Rome, LA 00187",Sallustiano,"What 1,223 people are saying",4.6,4.5,4.6,4.5,4.3,,,Does Hard Rock Cafe - Rome offer delivery through OpenTable or takeout?,You can order delivery directly from Hard Rock Cafe - Rome using the Order Online button. Hard Rock Cafe - Rome also offers delivery in partnership with Deliveroo.,How is Hard Rock Cafe - Rome restaurant rated?,"Via Vittorio Veneto 62A/B,  Rome, LA 00187",https://www.hardrockcafe.com/location/rome#utm_source=rest_of_network&utm_medium=Yext&utm_campaign=Listings,
"Al Vero Girarrosto Toscano Restaurant - Rome, LA | OpenTable",,Al Vero Girarrosto Toscano,4.8,4.8,3 Reviews,,06 482 1899,"29 Via Campania,  Rome, LA 00184",Ludovisi,,4.8,4.8,4.7,,4.6,3 Reviews,,How is Al Vero Girarrosto Toscano restaurant rated?,Al Vero Girarrosto Toscano is rated 4.8 stars by 3 OpenTable diners.,Is Al Vero Girarrosto Toscano currently accepting reservations?,"29 Via Campania,  Rome, LA 00184",http://www.alverogirarrostotoscano.it/,06 482 1899
"Mister Pizza Restaurant - Firenze, Toscana | OpenTable",See all 5 photos,Mister Pizza,,,No Reviews,"Ti presento Mister Pizza, la pizza leggera e digeribile.    Il nostro segreto è la speciale “Ricetta Mister Pizza”, un esclusivo metodo di doppia lievitazione e maturazione dell’impasto di 36 ore a temperatura controllata.    Grazie alla Ricetta Mister Pizza, la nostra pizza è ogni giorno leggera e una garanzia di digeribilità.    Inoltre, ogni pizza nel menù di Mister Pizza è disponibile in uno dei nostri 4 impasti: classico, senza glutine, ai cereali e integrale.    E quando i latticini sono un problema, le nostre mozzarelle senza lattosio o vegane a base di cocco, accontentano tutti.    Tutto questo si unisce a ingredienti ricercati e 100% Made in Italy: sulla tua pizza non finiranno mai ingredienti da discount o acquistati al risparmio.",055 238 2263,"5r Piazza del Duomo,  Firenze, Toscana 50122",San Giovanni,Be the first to review this restaurant,4.7,5.0,5.0,4.3,4.7,,,Does Mister Pizza offer delivery through OpenTable or takeout?,Mister Pizza does offer delivery in partnership with Deliveroo.,Is Mister Pizza currently accepting reservations?,"5r Piazza del Duomo,  Firenze, Toscana 50122",https://www.misterpizza.it/dove-siamo/piazza-duomo/,055 238 2263
"Obicà Mozzarella Bar - Firenze Restaurant - Florence, Florence | OpenTable",See all 34 photos,Obicà Mozzarella Bar - Firenze,4.7,4.7,30 Reviews,"Obicà Mozzarella Bar is an informal and contemporary restaurant and pizzeria in the heart of Florence, in via de 'Tornabuoni.

Obicà offers the best Mozzarella di Bufala Campana DOP, pizzas and traditional Italian dishes in a welcoming and convivial atmosphere.",055 277 3526,"Via Dei Tornabuoni 16,  Florence, Florence 520123",,What 30 people are saying,4.7,4.5,4.1,4.6,4.2,30 Reviews,,Does Obicà Mozzarella Bar - Firenze offer delivery through OpenTable or takeout?,Obicà Mozzarella Bar - Firenze does offer delivery in partnership with Deliveroo.,How is Obicà Mozzarella Bar - Firenze restaurant rated?,"Via Dei Tornabuoni 16,  Florence, Florence 520123",http://www.obica.com/ristoranti/firenze,
"Parione Restaurant - Florence, TO | OpenTable",See all 26 photos,Parione,4.7,4.7,39 Reviews,,055 214005,"74/76 r Via di Parione,  Florence, TO 50123",,What 39 people are saying,4.7,,4.8,4.7,4.5,39 Reviews,"MK   MKy1   Dallas          47 reviews    vip                             5.0           47 reviews    Dined on December 29, 2023     Overall  5    Food  5    Service  5    Ambience  5      Beautiful restaurant with an excellent menu. We had Gianni who served us and all our selections were exceptional. Great pasta and meat. Definitely a must to experience.                     Is this helpful?          Report        MC   MikeC   Atlanta Metro          5 reviews                              5.0           5 reviews    Dined on December 8, 2023     Overall  5    Food  5    Service  5    Ambience  5      We were seated (by request) in the wine cellar.  Great ambience and private setting with a small number of tables.  The food was outstanding (veal, pappardelle bolognese) and the Bolgheri wine was special.  This is one of Florence's best restaurants for a terrific evening with great food, great service and incredible wine!  Enjoy.                     Is this helpful?          Report        s   stevenc   Philadelphia          11 reviews                              5.0           11 reviews    Dined on December 4, 2023     Overall  5    Food  5    Service  5    Ambience  5      Great meal with recommendations from Danilo our waiter. Very friendly.   2 pasta dishes, Pici and tagliatelle with porcini mushrooms.  Pici was very special and a house speciality.  Followed by Bistecca Fiorentina.   Add vermintino and a Chianti with the meat and was very nice accompaniment.   Price point was very good for the quality of food wine and service.                                    Is this helpful?          Report        TB   TonyB   Greater Boston          57 reviews    vip                             5.0           57 reviews    Dined on October 28, 2023     Overall  5    Food  5    Service  5    Ambience  5      We had a traditional liver pate bruschetta followed by the best Ossobuco I’ve ever had. Served with a black rice the meat was super tender and the sauce was incredibly flavorful. The wine list was extremely manageable.                                    Is this helpful?          Report        S   Stemguy   San Francisco          35 reviews                              5.0           35 reviews    Dined on October 21, 2023     Overall  5    Food  5    Service  5    Ambience  5      Great experience all around. Positive energy in the restaurant                     Is this helpful?          Report        AG   AnitaG   Toronto          2 reviews                              5.0           2 reviews    Dined on October 14, 2023     Overall  5    Food  5    Service  5    Ambience  5      This was my first time in Florence! I dined with my son for a very special night and Parione was the very best restaurant that we enjoyed!!! Absolutely incredible food, service, ambience and the most incredible overall experience ever!!! The owner personally made sure we were enjoying ourselves and everyone was so sincerely inviting!!! We will be back!!! Book this restaurant!!!!!❤️\uD83C\uDDE8\uD83C\uDDE6\uD83C\uDDEE\uD83C\uDDF9\uD83C\uDDF2\uD83C\uDDF9                     Is this helpful?          Report        OT   OpenTable Diner   Atlanta Metro          1 review                              5.0           1 review    Dined on October 14, 2023     Overall  5    Food  5    Service  5    Ambience  5      Amazing food atmosphere and service! We would absolutely recommend to anyone                     Is this helpful?          Report        a   amee   Chicago          31 reviews    vip                             3.0           31 reviews    Dined on October 9, 2023     Overall  3    Food  2    Service  4    Ambience  4      This place looked the part: The room we were in was beautiful, the service expert. But the food was bland and unloved. Nothing was particularly good and a couple dishes were aggressively unflavored. There are much much better and more caring restaurants just steps away.                     Is this helpful?          Report        LD   LisaDee   New York City          10 reviews    vip                             5.0           10 reviews    Dined on October 7, 2023     Overall  5    Food  5    Service  5    Ambience  5      Our second night in Florence and this restaurant did not disappoint.  We were seated downstairs in the wine cellar which is quaint and beautiful.  We were 5 people and all of our dinner and appetizers were delicious.  Steak Florentine the best in Florence.  Cooked to perfection.  Pasta spectacular. They also have an extensive wine menu.  
I highly recommend this restaurant if your are looking for an authentic Italian meal                     Is this helpful?          Report        DR   DeborahRR   Dallas          2 reviews                              4.0           2 reviews    Dined on October 2, 2023     Overall  4    Food  5    Service  4    Ambience  4      I lost my husband one year ago and I had refused to dine solo the entire year.  My trip Florence and Tuscany over the 1 year milestone was what I needed in my grief journey.  “Graduation night” was the last evening and going solo at a fine dining establishment.  The steak Florence was superb, the staff clearly busy (place sold out) was kind and gracious to the only solo table there that night.   Yes I felt awkward and self conscious but not the establishment fault.  It will be awhile before I dine out alone again but glad my first time was at Pariones.  Bless you guys                                    Is this helpful?          Report        OT   OpenTable Diner   Los Angeles          3 reviews    vip                             5.0           3 reviews    Dined on August 27, 2023     Overall  5    Food  5    Service  5    Ambience  5      One of the best food we tasted in Florence, amazing experience. Gnocchi & Florentine steak is a must 10/10                     Is this helpful?          Report        J   Jess   Orange County          1 review                              5.0           1 review    Dined on August 14, 2023     Overall  5    Food  5    Service  5    Ambience  5      Danielo was the absolute best server we had in our entire trip to Italy. He told us his favorites dishes or broke down meals we had questions about and was so friendly and attentive. The food and his recommendations were amazing and the ambience was perfect for a date night. Danielo made this place 10000/10 — He was the best!!!!!                                                      Is this helpful?          Report        CS   ChristopherS   Fayetteville          1 review                              5.0           1 review    Dined on August 11, 2023     Overall  5    Food  4    Service  5    Ambience  5      Great restaurant. Charming ambience and loved the little upstairs loft seating. Charcuterie plate with pear and prosciutto was EVERYTHING- pasta delicious, the Osso buco a little fatty but very tasty. Highly recommend!!                     Is this helpful?          Report        JE   JanE4bama   Alabama          8 reviews                              5.0           8 reviews    Dined on August 2, 2023     Overall  5    Food  5    Service  5    Ambience  5      We sat upstairs.  Enjoyed our seating but wish I had requested seating in the wine cellar.  The salami pears prosciutto appetizer was delicious.  Our party of 3 had  shrimp risotto, fried eggs with black truffle, and sea bass.  Highly recommend.                     Is this helpful?          Report        OT   OpenTable Diner   Melbourne          2 reviews                              5.0           2 reviews    Dined on July 22, 2023     Overall  5    Food  5    Service  5    Ambience  4      Great dinner and excellent service by Ardy? Will recommend                     Is this helpful?          Report        J   Jodavesa   Tampa          5 reviews                              5.0           5 reviews    Dined on June 29, 2023     Overall  5    Food  5    Service  5    Ambience  5      I had the gamberoni a farfalla con fagioli bianchi e filetto di pomodoro and the branzino. Everything was delicious. The house wine was perfect also.                                             Is this helpful?          Report        EB   EleB   London          10 reviews                              3.0           10 reviews    Dined on May 21, 2023     Overall  3    Food  3    Service  4    Ambience  3      Good food and the cellar seating is lovely - a bit more touristy that expected.                     Is this helpful?          Report        A   Amypc   Fort Lauderdale          5 reviews                              5.0           5 reviews    Dined on May 2, 2023     Overall  5    Food  5    Service  5    Ambience  5      Fantastico, delizioso,  every run treated us like honored guests.  I am a travel agent and I will be recommending them to all my clients that go to Florence.                     Is this helpful?          Report        KC   KCLAB   Denver          4 reviews                              5.0           4 reviews    Dined on April 25, 2023     Overall  5    Food  5    Service  5    Ambience  5      When we visit Florence, there is always dinner at Parione’s.
The staff is so welcoming and fun, and the food is always amazing. Don’t miss this restaurant!                                             Is this helpful?          Report        k   karmcr   Greater Boston          59 reviews    vip                             5.0           59 reviews    Dined on March 27, 2023     Overall  5    Food  5    Service  5    Ambience  5      Vacation with my daughter; restaurant recommended to us. Lovely environment, service and food, grazie! I'm                                    Is this helpful?          Report        HS   HarryS   Richmond          21 reviews    vip                             5.0           21 reviews    Dined on March 27, 2023     Overall  5    Food  5    Service  5    Ambience  5      Great night.  Wonderful food and better service.  Definitely a place to go for a great Tuscan meal.                     Is this helpful?          Report        MM   MiamiMark   Miami          76 reviews    vip                             4.0           76 reviews    Dined on January 3, 2023     Overall  4    Food  5    Service  4    Ambience  3      The food and service were very good, a little pricey but not outrageous, but the restaurant is very tightly packed.  We were seated upstairs, and it was very warm up there even though it was cold outside, and we could barely move our chairs because the tables were so close together.  We couldn't wait to get the check and leave.   I would not return if I had to sit upstairs again, or the tables were so close together.                     Is this helpful?          Report        SO   SusanO   New York City          9 reviews    vip                             5.0           9 reviews    Dined on November 2, 2022     Overall  5    Food  5    Service  5    Ambience  5      Charming place steps from the Carreira Bridge. All pastas made in house. My husband had the veal cheeks which were divine. Best Triamasu ever. Well priced wine list. Attentive service.                     Is this helpful?          Report        OT   OpenTable Diner   London          1 review                              5.0           1 review    Dined on September 25, 2022     Overall  5    Food  5    Service  5    Ambience  5      Amazing experience and even better food!                     Is this helpful?          Report        PK   PamK   Nashville          7 reviews                              5.0           7 reviews    Dined on September 24, 2022     Overall  5    Food  5    Service  5    Ambience  5      Wonderful Place… loved it!                     Is this helpful?          Report        HR   HobokenRes   Chicago          6 reviews                              5.0           6 reviews    Dined on August 19, 2022     Overall  5    Food  5    Service  5    Ambience  5      Simply fantastic. The best by far!                     Is this helpful?          Report        HR   HobokenRes   Chicago          6 reviews                              5.0           6 reviews    Dined on August 18, 2022     Overall  5    Food  5    Service  5    Ambience  5      One of my favourite restaurants in Florence. From the antipasto to the pasta and then the Bisteca Fiorentina the food is out of this world. The staff and the owner are lovely and very much made us feel like family. I can only highly recommend the restaurant! We will come back                     Is this helpful?          Report        OT   OpenTable Diner   Kansas City          3 reviews                              5.0           3 reviews    Dined on July 16, 2022     Overall  5    Food  5    Service  5    Ambience  5      Otto our server was the best. So funny and clever.                     Is this helpful?          Report        OT   OpenTable Diner   Mexico City          2 reviews                              5.0           2 reviews    Dined on July 11, 2022     Overall  5    Food  5    Service  5    Ambience  5      Un lugar de primera , la cocina es excelente . De los lugares mas recomendados si visitan Florencia.                     Is this helpful?          Report        S   Sner   Los Angeles          24 reviews                              5.0           24 reviews    Dined on June 30, 2022     Overall  5    Food  5    Service  5    Ambience  5      The food is the best in Firenze! A very festive atmosphere. Service is excellent. This is not a tourist trap. It’s the real thing. We recommend it highly. It is a must for us every time we visit Firenze.                     Is this helpful?          Report        M   Marie   Tuscany          1 review                              5.0           1 review    Dined on May 27, 2022     Overall  5    Food  4    Service  5    Ambience  5      The atmosphere was very authentic, the service and the food were amazing!!!                     Is this helpful?          Report        M   Maria   London          4 reviews                              5.0           4 reviews    Dined on May 23, 2022     Overall  5    Food  5    Service  5    Ambience  4      The food was excellent, so tasty.
We loved it.
Wish we could try everything!!!                     Is this helpful?          Report        OT   OpenTable Diner   San Francisco          2 reviews                              5.0           2 reviews    Dined on March 23, 2022     Overall  5    Food  5    Service  5    Ambience  5      Great service. Food always good                     Is this helpful?          Report        R   Rajj   London          77 reviews    vip                             4.0           77 reviews    Dined on February 25, 2022     Overall  4    Food  4    Service  4    Ambience  4      Great tuscan look and feel restaurant. As a tourist well worth the effort to eat here                     Is this helpful?          Report        d   deenam   London          38 reviews    vip                             3.0           38 reviews    Dined on November 20, 2021     Overall  3    Food  4    Service  4    Ambience  4      Overall theme of a week in Florence is that 7-8pm is too early for most restaurants. Even though they are open..they want you to
Come later, they want you to wait, beg even? Don’t know but we tired of always having to wait ..then the restaurant filling and service slow. We are repeat diners at most of our favorite places .. parione is lovely. Prefer downstairs ..bisteca great, apps great. Didn’t like the up selling on every wine, every course. I don’t need to be over fed abs I know what I like.                     Is this helpful?          Report        OT   OpenTable Diner   Italy          1 review                              5.0           1 review    Dined on June 11, 2021     Overall  5    Food  5    Service  5    Ambience  5      Absolutely gorgeous restaurant! We just had dinner there and loved it so much. Food was great, staffs were greater/ especially our server Otto was the most pleasant and kind guy of all.                                                      Is this helpful?          Report        JL   JeanLucPicard   Greater Boston          100 reviews    vip                             3.0           100 reviews    Dined on February 18, 2020     Overall  3    Food  4    Service  2    Ambience  4      We were seated in the wine cellar which was very comfortable, food was excellent octopus, eggplant and wild boar was fantastic. But the service was inattentive and seemingly purposefully slow. Waiter told some tables specials, but we were not told any specials. Our waiter obviously catered to locals over tourists, which is off putting for some one like myself who works in the restaurant business and takes pride in being accommodating to all my guests.                     Is this helpful?          Report        F   Foodie411   Houston          45 reviews    vip                             5.0           45 reviews    Dined on December 29, 2019     Overall  5    Food  5    Service  5    Ambience  3      Excellent service, food and wine. Osso buco best in the world. Make a reservation. Walking distance from Ponte Vecchio, Westin, St Regis. Great shopping nearby. Both luxury and quaint, intimate shops. Doesn’t open until 7pm like most Italian restaurants.                     Is this helpful?          Report        T   Troy   Wilmington          1 review                              5.0           1 review    Dined on November 28, 2019     Overall  5    Food  5    Service  5    Ambience  5      Amazing restaurant!! We had a romantic dinner in the wine cellar. The meal was fantastic. As we left we made another reservation for the last night we would be in Florence.                     Is this helpful?          Report",How is Parione restaurant rated?,Parione is rated 4.7 stars by 39 OpenTable diners.,Is Parione currently accepting reservations?,"74/76 r Via di Parione,  Florence, TO 50123",http://www.parione.net/,055 214005
