name,other,restaurant name,rating,rating,other,additional informations,phone number,address,location,other,rating,rating,rating,rating,rating,reviews count,other,rating,additional informations,other,address,website,phone number
"STK Milan Restaurant - Milan, Lombardy | OpenTable",See all 99 photos,STK Milan,4.7,4.7,326 Reviews,"STK Milan hails as the sexiest steakhouse to hit Milan. Its unique concept artfully blends the modern steakhouse and chic lounge into one, offering a dynamic, fine dining experience with the superior quality of a traditional steakhouse.   STK Milan distinguishes itself by focusing on the social experience with a sleek, contemporary design and an in-house DJ who creates an infectious, high-energy vibe.   The menu features reimagined classic American cuisine with signature dishes like bite sized Lil’brgs made with Wagyu beef, lobster Mac & Cheese and, of course, the highest quality USDA Prime steak.   STK Milan defines the modern fine dining experience with incredible food, world-class service and the perfect atmosphere.",02 8422 0110,"STK Milan, Piazza Della Republica 13, Milan, Lombardy 20124",Centro Direzionale di Milano,What 326 people are saying,4.7,4.6,4.7,4.8,4.3,326 Reviews,"JS   JonnySam   Las Vegas          8 reviews                              5.0           8 reviews    Dined 6 days ago     Overall  5    Food  5    Service  5    Ambience  5      Ristorante top. Locale di livello , staff preparato. Consigliatissimo                     Is this helpful?          Report        IH   IeshiaH   Caribbean          1 review                              5.0           1 review    Dined on January 6, 2024     Overall  5    Food  4    Service  5    Ambience  5      Waiter was amazing. Ambience was perfect with an amazing DJ.              STK Milan   Responded on January 8, 2024    Dear IeshiaH,
thank you for the fantastic 5-star review!  We’re happy to know that you had good experience with us and with our team.
Looking forward to welcome you again at STK Milan!
have a lovely day,
Valentina G.                      Is this helpful?          Report        OT   OpenTable Diner   Berlin          25 reviews    vip                             5.0           25 reviews    Dined on January 4, 2024     Overall  5    Food  5    Service  5    Ambience  5      PERFETTOOO

10/10
Grazie per tutto
Molto buonissimo a la prossima              STK Milan   Responded on January 8, 2024    Gentile Ospite, GRAZIE A TE per questa concisa ma bellissima recensione. Grazie di cuore.
Alla prossima,
Valentina G.                      Is this helpful?          Report        VH   ValdrimH   Milan          1 review                              4.0           1 review    Dined on December 31, 2023     Overall  4    Food  3    Service  4    Ambience  4      Overall it was good. The food was okay - I was expecting grated truffle on the fries and not a little truffle oil. No bread with the tartare, even after asking twice. The fillet was well instead of medium. Music was good and the people were nice.              STK Milan   Responded on January 2, 2024    Thank you Valdrim H, we appreciate your rating and the 4 start you left us! We’re glad to hear you had a positive experience overall. We appreciate your feedvback regarding the fries, but unfortunatly it is too hard to grate some truffle on it so we opted for a truffled oli that stays on the fries and mixes well with the parmesan. 
I really apologize for the bread, i think we really slipped there! so sorry!
we hope you can come visit us again, so we can make it up to you.

Best regards and happy new year!
Valentina G.                      Is this helpful?          Report        JS   JonnySam   Las Vegas          8 reviews                              5.0           8 reviews    Dined on December 30, 2023     Overall  5    Food  5    Service  5    Ambience  5      Ottimo locale nel cuore di Milano. Staff di livello e cibo buonissimo              STK Milan   Responded on January 2, 2024    Gentilissimo Jonny Sam, 
grazie per la concisa ma splendida review! siamo felici che tu abbia apprezzato STK Milan e soprattutto il nostro adorabile staff!
Speriamo di poterti ospitare nuovamente a STK Milan.
Un saluto,
Valentina G.                      Is this helpful?          Report        c   cristinap   New York City          2 reviews                              5.0           2 reviews    Dined on December 28, 2023     Overall  5    Food  5    Service  5    Ambience  5      Good meat, good music, good atmosfere, contemporary              STK Milan   Responded on January 2, 2024    Dear CristinaP,
our team is so grateful for the fantastic 5-star review!  We’re overjoyed to have given you a good experience.
have a lovely day!
Valentina G.                      Is this helpful?          Report        OT   OpenTable Diner   London          3 reviews                              5.0           3 reviews    Dined on December 25, 2023     Overall  5    Food  5    Service  5    Ambience  5      Amazing view and delicious food!! Very good atmosphere              STK Milan   Responded on January 2, 2024    Thank you for the five stars review! Those stars make our day brighter :)
cheers,
Valentina G.                      Is this helpful?          Report        ML   MatthewL   San Francisco          1 review                              5.0           1 review    Dined on December 16, 2023     Overall  5    Food  5    Service  5    Ambience  5      Very good food! And very friendly staff. The Wagyu was delicious. Maybe as a tip is a different way to serve the lobster tail, it is very difficult to get out of the shell.                     Is this helpful?          Report        JS   JonnySam   Las Vegas          8 reviews                              5.0           8 reviews    Dined on December 1, 2023     Overall  5    Food  5    Service  5    Ambience  5      Amazing experience on Friday night. Great music and we really enjoyed food and service                     Is this helpful?          Report        OT   OpenTable Diner   Milan          1 review                              4.0           1 review    Dined on November 29, 2023     Overall  4    Food  4    Service  4    Ambience  5      Location molto elegante e raffinata, camerieri gentilissimi e ottimo rapporto qualità/prezzo. 
Tornerò sicuramente.                                    Is this helpful?          Report        MA   MaorA   Milan          1 review                              5.0           1 review    Dined on November 27, 2023     Overall  5    Food  5    Service  5    Ambience  5      It was a really good place, everything was perfect                     Is this helpful?          Report        JS   JonnySam   Las Vegas          8 reviews                              5.0           8 reviews    Dined on November 24, 2023     Overall  5    Food  5    Service  5    Ambience  5      Ottima esperienza culinaria e atmosfera bella e divertente . Cibo e servizio di qualità                     Is this helpful?          Report        S   Smgvri   Oxford          2 reviews                              5.0           2 reviews    Dined on November 17, 2023     Overall  5    Food  5    Service  5    Ambience  5      Brilliant service by Solaman, amazing food,great ambience              STK Milan   Responded on November 25, 2023    Thank you for taking the time to leave us a beautiful review,  it's much appreciated! 
We continuously work to create good experiences for our customers and your feedback makes it all
worth it. We look forward to serving you in the future at STK Milan!
Valentina G                      Is this helpful?          Report        JS   JonnySam   Las Vegas          8 reviews                              5.0           8 reviews    Dined on November 16, 2023     Overall  5    Food  5    Service  5    Ambience  5      Cucina americana, carne ottima e servizio di livello alto. Offerta del giovedì assolutamente da provare .              STK Milan   Responded on November 25, 2023    Marco, grazie per l'ottima recensione! Siamo felici che la tua esperienza sia stata positiva e non vediamo l'ora di rivederti; magari nuovamente un giovedì per ri-gustare il nostro THURSDAY FEELS menu!
A presto,
Valentina G.                      Is this helpful?          Report        SW   SamW   Liverpool          1 review                              5.0           1 review    Dined on November 9, 2023     Overall  5    Food  5    Service  5    Ambience  5      Very good food, as well as the service. Maybe a little too dark but the overall atmosphere was really enjoyable.              STK Milan   Responded on November 25, 2023    Dear Sam, thank you for taking the time to leave us this nice review,  it's very appreciated! At [RESTAURANT NAME],
We continuously work to create good experiences for our customers so next time you will be in town, please come visit us again, we will make sure to give you a table with a little more light (please ask for it to our team)! We look forward to welcome you in the future!
Valentina G.                      Is this helpful?          Report        JS   JonnySam   Las Vegas          8 reviews                              5.0           8 reviews    Dined on October 31, 2023     Overall  5    Food  5    Service  5    Ambience  5      We had dinner last night for Halloween and it was amazing. The decor of the restaurant was stunning. They brought us a portion of pumpkin with our main meal as complementary, very appreciated.
Salvatore our waiter made us feel home.              STK Milan   Responded on November 3, 2023    Dear Mike,
We really appreciate you taking the time to share your  lovely review with us. We are so happy to know that you loved our halloween decors and especially our staff! The Chef really nailed it with that side of Pumpking! We look forward to seeing you again soon.
Cheers,
Valentina G.                      Is this helpful?          Report        KS   KerryS   London          2 reviews                              5.0           2 reviews    Dined on October 30, 2023     Overall  5    Food  5    Service  5    Ambience  5      First experience here, as soon as we walked in i knew it was perfect. Celebrated my daughters 18th. Yes expensive but i wanted something nice and memorable. The atmosphere added to the occasion, dimmed lights, music. It couldn't have been more perfect. The staff are lovely and attentive, i'd def revisit again. Thank you                                      STK Milan   Responded on November 3, 2023    Dear Kerry,
Thank you so much for taking the time to leave an excellent rating. We love to hear that we were able to make your night 'memorable'!
We really hope that your daughter enjoyed her birthday to fullest!
Looking forward to see you again at STK Milan!
Best regards,
Valentina G.                      Is this helpful?          Report        TT   TannerT   Greater Boston          3 reviews    vip                             5.0           3 reviews    Dined on October 28, 2023     Overall  5    Food  4    Service  5    Ambience  5      Wonderful experience at STK Milan inside the ME by Meliã hotel. I am an American traveling in Italy for a few months and was craving a steak dinner. STK did not disappoint. Upon climbing the spiral staircase, diners are greeted by a dinning room that is contemporary and sexy yet sophisticated. Everyone from the hostess to the servers provided excellent service and provided great recommendations for dishes. I started off with the calamari fritti which provided a nice balance between the fish and fried batter. My server’s suggestion of the sliced filet medallion satisfied my yearning for a steak and was paired with a potato cake and a bold au poivre sauce. I will be back next time I am in Milan to try some of their other offerings on the menu.              STK Milan   Responded on October 30, 2023    Dear Tanner, Thank you so much for taking the time to leave us this wonderful review, we really appreciated it! At STK Milan, we strive to create good experiences for our customers and your feedback makes it all worth it. i will make sure to share this lovely review with all the team!
We look forward to welcome you in the future! 
Cheers, Valentina G                      Is this helpful?          Report        LM   LemetrestM   Guam          1 review                              3.0           1 review    Dined on October 27, 2023     Overall  3    Food  4    Service  2    Ambience  5      Very beautiful restaurant with great ambience. I booked about two weeks before for my husbands birthday. When we arrived they greater us warmly and we received our food quickly. The food was good. For the price, I would would not consider it spectacular. I have had much better for cheaper and for equally price food. After eating our food there were  3 other tables who the staff came and sang happy birthday to. Upon waiting fifteen minutes for our waiter to check on us, offer dessert, a check or a happy birthday surprise I finally asked for the check. Five minutes later the waiter comes with a cake. Replies oh and happy birthday and gives us the check. No other staff members came over to sing and we even had to flag our waiter down for silverware to eat the cake. Highly disappointed that myself and my daughter has to sing happy birthday to my husband. Despite the fact that the staff sang to three other parties.              STK Milan   Responded on October 30, 2023    Dear guest, We're sorry to hear that you felt like we didn't accommodate your request, unfortunately at that moment our staff wasn't available to sing happy birthday, so sorry! We un apologize for falling short in this area. We're thankful for your feedback and we are happy to know that you still enjoyed our food. I will make sure to review this with all the staff. 
Best regards, Valentina G                      Is this helpful?          Report        JS   JonnySam   Las Vegas          8 reviews                              5.0           8 reviews    Dined on October 26, 2023     Overall  5    Food  5    Service  5    Ambience  5      Best Steakhouse in town. Food is amazing and staff is super. They really look after you. Great spot in Milan              STK Milan   Responded on October 30, 2023    Dear Nick, behalf of the STK Milan team, thank you for the awesome review! Our team works very hard to create good experiences for our customers and we’re happy to hear that we hit the mark. Looking forward to welcome you again!
Cheers,
Valentina G.                      Is this helpful?          Report        AG   AdrianG   Milan          1 review                              4.0           1 review    Dined on October 17, 2023     Overall  4    Food  4    Service  5    Ambience  5      Very friendly stuff, extremely helpful, the food was very good and perfectly cooked. The guys that bring the food to the table were very polite but they knew no English so it was a bit hard to communicate with them where to put the plates and who ordered what , and also the water was the most expensive we had in Milan , a bottle of water was the same price with a cocktail =))). But definitely worth it              STK Milan   Responded on October 30, 2023    Dear Andrian G, Thank you so much for the kind words. We’re very happy to hear that you had a good experience with us! Regaqrding the water, it's at the same price range as per the other restaurants like ours. We do reccomend a drink instead :).
Best regards,
Valentina G.                      Is this helpful?          Report        OT   OpenTable Diner   Houston          1 review                              5.0           1 review    Dined on October 14, 2023     Overall  5    Food  5    Service  5    Ambience  5      Marco was amazing. I hope this is how he spells his name. First time visiting from the us and he went above and beyond to make my friend and I happy. Free shots.. birthday cakes… I mean he was awesome… Loved it. Will definitely come back next time I visit Milan.              STK Milan   Responded on October 17, 2023    Thanks for taking the time to write this beautiful review; it means a lot to us. Marco will be happy to read you feedback (and yes, you spelled it right :) ).  We will be happy to have you again when you come back to Milan!
Cheers!
Valentina G.                      Is this helpful?          Report        JS   JonnySam   Las Vegas          8 reviews                              5.0           8 reviews    Dined on October 6, 2023     Overall  5    Food  5    Service  5    Ambience  5      Great experience . Amazing food and staff was really friendly and professional. I’ll see you soon.              STK Milan   Responded on October 30, 2023    Dear John, Thank you for leaving us such an awesome review! We will be happy to see you again! See you soon
Cheers,
Valentina G.                      Is this helpful?          Report        TP   ThomasP   London          1 review    vip                             5.0           1 review    Dined on September 29, 2023     Overall  5    Food  5    Service  5    Ambience  5      Great meal , lively Friday night atmosphere , great server, very well informed on dishes and ingredients and knowledgeable  on wine and cocktails. Food well presented, tasty and the right portion sizes.Steak was cooked medium rare and the grain of the meat showed me it was of the correct quality for a restaurant of this price point, sides well seasoned and tasty.In terms of drinks , red wine selection 10/10 cocktail recommendation would be the cucumber stiletto. Overall STK is a great weekend destination spot for some food and music.              STK Milan   Responded on October 14, 2023    Dear ThomasP, I just wanted to say thank you for coming to STK Milan and also taking the time to share your great experience on here!
We all hope to welcome you back soon!
Wishing you a lovely day,
Valentina G.                      Is this helpful?          Report        OT   OpenTable Diner   Raleigh          1 review    vip                             3.0           1 review    Dined on September 25, 2023     Overall  3    Food  3    Service  5    Ambience  5      I expected better tasting steaks from a high end steak restaurant. A good wine list and great service.              STK Milan   Responded on September 27, 2023    Dear Guest, Thank you for the review and we are so sorry about your steak, we have a high standard of quality for our steaks and definitely pride ourselves as we do this best so i hope you could come visit us again bevuase i am sure we cacn have you change your mind! Very happy to hear our service made up for your steak.
We certainly hope we can welcome you again to give us another chance to dazzle you steak connoisseurs!
Best regards,
Valentina G.                      Is this helpful?          Report        OT   OpenTable Diner   New York City          1 review                              2.0           1 review    Dined on September 23, 2023     Overall  2    Food  2    Service  3    Ambience  4      not even comparable to the stk around the world , am client of this chain around the world                     Is this helpful?          Report        A   Andrew   Milan          1 review                              5.0           1 review    Dined on September 13, 2023     Overall  5    Food  5    Service  5    Ambience  5      Great food, great service, excellent experience!! Would recommend:)              STK Milan   Responded on September 27, 2023    Dear Andrew,
Thank you for taking the time to review your experience with us! Our teams work very hard to deliver the very best STK experience to all that join us. We look forward to welcoming you back again very soon!
Best regards,
Valentina G.                      Is this helpful?          Report        J   Jmaciasrendon   Mexico City          8 reviews                              5.0           8 reviews    Dined on September 8, 2023     Overall  5    Food  5    Service  5    Ambience  5      En principio la calidez de su personal muy buena, seguido de una ambiente agradable y la comida muy buena              STK Milan   Responded on September 27, 2023    Dear Jmaciasrendon, Thank you for your lovely feedback. We hope to welcome you again at STK Milan! 
All the best,
Valentina G.                      Is this helpful?          Report        N   Norway   Milan          1 review                              5.0           1 review    Dined on August 26, 2023     Overall  5    Food  5    Service  5    Ambience  5      Excelent service and good Food. 
Could have been some vegetabels with the steak.              STK Milan   Responded on August 29, 2023    Dear Norway, Thank you for coming in! We love to read review like yours, i will make sure to let ur staff know about your feedback. 
Regarding the steak we usually serve it 'plain' all over the world to make sure it remains the main star of the night! :)
We hope to see you again at STK Milan!
Best regards
 Valentina G                      Is this helpful?          Report        GO   GusO   Columbus          10 reviews    vip                             5.0           10 reviews    Dined on August 21, 2023     Overall  5    Food  5    Service  5    Ambience  5      The service was great, they were very accommodating of my allergies! Food was tasty and high quality.              STK Milan   Responded on August 25, 2023    Dear Guest, thank you for this positive review. We have very glad to know that we were able to satisfy your needs and your eperience was good! We hope to see you soon at STK Milan!
Best regards,
Valentina G.                      Is this helpful?          Report        RG   RachelG   New York City          30 reviews    vip                             1.0           30 reviews    Dined on August 15, 2023     Overall  1    Food  1    Service  1    Ambience  1      Our experience was nothing short of a disaster, and I feel compelled to share our unfortunate encounter.

We had booked a reservation for a special birthday dinner, eagerly anticipating the wonderful evening we've had at STK locations in other cities, especially in NYC. However, our excitement turned to shock and dismay when we arrived at the restaurant. The pictures, reservation confirmation, and even the menu from the OpenTable confirmation were all entirely misleading and false.

To our disbelief, upon arrival, we discovered that the restaurant was closed. The gentleman said “if you haven’t had STK before this will be similar.” I was baffled! We were redirected to an upstairs terrace, which was more reminiscent of a crowded bar scene than the elegant dining experience we had envisioned. The limited menu provided fell far short of our expectations, and to add insult to injury, we were subjected to people smoking around us. This was a far cry from the celebratory atmosphere we had hoped for and experienced in other STK locations.

The waiter was unable to open a bottle of wine, steak was cooked and presented horribly, and service was not good. It is honestly a disgrace to call yourself STK, it’s ruining your reputation, and turning away customers for future visits.

What truly baffles me is the complete lack of communication. Not a single word of explanation was given in advance – no email, no phone call, no attempt whatsoever to inform us of the situation. Had we been made aware of the changes, we certainly would not have chosen to dine in such an inappropriate setting.

If I could erase this meal, I would. I am embarrassed for STK.                     1 person found this helpful          Report        JB   JennyB   Yorkshire          1 review                              5.0           1 review    Dined on August 1, 2023     Overall  5    Food  5    Service  5    Ambience  5      STK was a brilliant place to eat during our trip. The staff were amazing, including them being extremely patient with us being late. The service was quick and everything was delicious and it was a great atmosphere, would definitely come back and recommend!                     Is this helpful?          Report        PM   PeterM   Switzerland          2 reviews                              5.0           2 reviews    Dined on July 29, 2023     Overall  5    Food  5    Service  5    Ambience  5      Fantastic atmosphere, food and service outstanding. Highly recommended for real steak lovers!              STK Milan   Responded on August 1, 2023    Dear Peter, Thank you for choosing STK Milan and writing this nice review, we’re glad to hear that you had a great experience at STK!  We are looking forward to see you again! Best regards, Valentina G                      Is this helpful?          Report        E   Eliana   London          1 review                              5.0           1 review    Dined on July 27, 2023     Overall  5    Food  5    Service  5    Ambience  5      Very nice high quality service, the design is breathtaking and the staff is amazing. For sure we will come back again☺️              STK Milan   Responded on August 1, 2023    Dear Eliana, Thank you for choosing our restaurant and writing this lovely review, we’re glad to hear that you loved your experience at STK! We cannot wait to welcome you again!
Best regards, Valentina G                      Is this helpful?          Report        HC   HannahC   Las Vegas          8 reviews    vip                             5.0           8 reviews    Dined on July 7, 2023     Overall  5    Food  5    Service  5    Ambience  5      Amazing service and outstanding food the mini burger sliders stole the show would definitely come back                                                               Is this helpful?          Report        C   Claudio   Milan          1 review                              5.0           1 review    Dined on July 6, 2023     Overall  5    Food  5    Service  5    Ambience  5      Serata indimenticabile. Location elegante e di classe. Abbiamo mangiato una tomahawk spettacolare, cotta alla perfezione e saporitissima. Riaz, un cameriere gentilissimo e professionale, ci ha consigliato di scegliere anche 'Mac and Cheese', un timballo di pasta e cheddar mai mangiato così buono. Abbiamo preso anche una porzione di tacos e i mini-burger. Tutto davvero eccellente... ciliegina sulla torta: un dolce con candelina a chiusura di una cena speciale per un compleanno importante! Una esperienza assolutamente da ripetere                                                                        Is this helpful?          Report        CK   CenkK   London          37 reviews    vip                             5.0           37 reviews    Dined on July 1, 2023     Overall  5    Food  5    Service  5    Ambience  5      Very good food and attentive team to assist you 
T bone was very good and we shared 4 people. Only they do not serve ice cream rather than comes next to desert. Music was lower compared yo London STK                     Is this helpful?          Report        G   Gracie   Philadelphia          8 reviews    vip                             5.0           8 reviews    Dined on July 1, 2023     Overall  5    Food  5    Service  5    Ambience  5      Really cool place with excellent service and outstanding food! Don’t go before 9:00 pm
Loved it!                     Is this helpful?          Report        F   Foodiefromthelakes   Cumbria          9 reviews                              5.0           9 reviews    Dined on June 27, 2023     Overall  5    Food  5    Service  5    Ambience  5      We had a lovely meal at STK, the service was great, our waiter gave us lots of helpful recommendations. The food was good. The wine was delicious and the atmosphere and music were great.                                                      Is this helpful?          Report        LM   LaurajaneM   Glasgow          1 review                              5.0           1 review    Dined on June 23, 2023     Overall  5    Food  5    Service  5    Ambience  5      We had a wonderful time at STK, our server Riaz made the experience unforgettable. We visited for my partners birthday and it was brilliant, thank you for a night we will not forget!                                               STK Milan   Responded on July 29, 2023    Dear Laura, thank you very much for taking the time to share your positive experience at STK Milan! We are happy to hear that we made your night unforgettable. Riaz will love to see your comment, we are very proud of him and all our staff! 
We hope you will visit us again very soon. 
Best regards, Valentina G.                      Is this helpful?          Report",How is STK Milan restaurant rated?,STK Milan is rated 4.7 stars by 326 OpenTable diners.,Is STK Milan currently accepting reservations?,"STK Milan, Piazza Della Republica 13, Milan, Lombardy 20124",http://www.stkhouse.com/,
