Book Title,Book Title,Author,Book Title,Price,Price,Seller,Category,Pages,Price,Book Description,Book Description,Author,Book Title,Book Description,Book Title,Pages,Price,Price,Price,Book Title,Book Title,Date of publication,Price,Price,Book Title
Metafisica concreta - Massimo Cacciari,Metafisica concreta,Massimo Cacciari,,"€ 38,00","€ 36,10",,Filosofia,,,"Metafisica: ecco la parola «davanti alla quale ognuno, più o meno, si affretta a fuggire come davanti a un appestato» (Hegel). Un fuggire che, a furia di decostruzioni, oltrepassamenti, dichiarazioni di morte o di inesorabile, fatale compimento nelle forme della razionalità scientifica, ha finito col diventare una sorta di habitus del pensiero contemporaneo. E tuttavia, ripercorrendo  contropelo  le filosofie classiche e i grandi sistemi del razionalismo moderno, così come le più ardite e recenti teorie della scienza, è possibile riscoprire ciò che di quel termine rimane  inaudito  : la  tessitura  che collega l’essente in quanto osservabile e determinabile allo  s-fondo  della sua provenienza e del suo imprevedibile avvenire; la relazione tra la  theoría  della cosa sotto l’aspetto della sua caducità, nell’ordine di Chronos, e quella che cerca di esprimerla nella sua relazione al Tutto e in tale relazione giunge a considerarla  res divina  . Nessun ‘al di là’, nessuna  Hinterwelt  , o mondo ‘dietro’  tà physiká  , dietro il manifestarsi di Physis. Questo mondo, e il soggetto che intende conoscerlo conoscendo sé stesso, il cui essere-possibile non si arrende al Muro dell’Impossibile, esigono di essere interrogati anche secondo una tale prospettiva.  Metafisica concreta  , dunque, come Florenskij, scienziato, filosofo e teologo, voleva intitolare l’opera che avrebbe dovuto concludere la sua ricerca. Filosofia e scienza possono in essa ritrovarsi ed esprimere insieme, in forme distinte e inseparabili, l’integrità e inesauribilità della vita dell’essente.",Come riscoprire ciò che della metafisica rimane inaudito.,Massimo Cacciari,Il lavoro dello spirito,L’attualità di Max Weber nella penetrante analisi di Massimo Cacciari.,"Piccola Biblioteca Adelphi, 751",2020 / pp. 118 /,"€ 13,00","€ 10,40","€ 6,99",Doppio ritratto,"Biblioteca minima, 48",2012 / pp. 88 /,"€ 7,00","€ 5,60","Martin Heidegger   L’inizio della filosofia occidentale   «L'inizio non sta più dietro di noi, alle no­stre spalle, bensì sta davanti a noi in quan­to compito essenziale della nostra più pro­pria essenza».              Emanuele Severino   Testimoniando il destino   I fondamenti della filosofia di Severino in una ulteriore, approfondita delucidazione.              Jacob Taubes, Carl Schmitt   Ai lati opposti delle barricate   «Sapevamo di essere nemici acerrimi, ma ci capivamo benissimo. Eravamo consapevoli di una cosa: di parlare allo stesso livello – e questo è molto raro» (Jacob Taubes).                  Martin Heidegger   Concetti fondamentali della filosofia aristotelica   Il preludio a  Essere e tempo  .              Emanuele Severino   Storia, Gioia   Il libro che svela il rapporto tra il pensiero filosofico di Severino più profondo, e ‘difficile’, e quello ‘più facile’, relativo all’attualità.              Carl Schmitt   Stato, grande spazio, nomos   Il pensiero di uno dei massimi filosofi della politica e del diritto in una imprescindibile raccolta di saggi.                  Emanuele Severino   Dike   Un cammino verso le radici del significato di  dike  : «il principio più stabile» secondo Aristotele.              Massimo Cacciari   Labirinto filosofico   2014, pp. 348, SALEPRICE              Martin Heidegger   Il «Sofista» di Platone   2013, pp. 667, SALEPRICE"
L’ora di greco - Han Kang,L’ora di greco,Han Kang,"Traduzione di Lia Iovenitti    Fabula  , 397   2023, 3ª ediz., pp. 163   isbn: 9788845938337","€ 18,00","€ 17,10",,Letteratura coreana,2023 / pp. 163 /,"€ 10,99","In una Seoul rovente e febbrile, una don­na vestita di nero cerca di recuperare la parola che ha perso in seguito a una serie di traumi. Le era già successo una prima volta, da adolescente, e allora era stato l’in­solito suono di una parola francese a scar­dinare il silenzio. Ora, di fronte al riaffio­rare di quel mutismo, si aggrappa alla ra­dicale estraneità del greco di Platone nel­la speranza di riappropriarsi della sua vo­ce. Nell’aula semideserta di un’accademia privata, il suo silenzio incontra lo sguardo velato dell’insegnante di greco, che sta per­dendo la vista e che, emigrato in Germa­nia da ragazzo e tornato a Seoul da qualche anno, sembra occupare uno spazio limina­le fra le due lingue. Tra di loro nasce un’in­timità intessuta di penombra e di perdi­ta, grazie alla quale la donna riuscirà for­se a ritornare in contatto con il mondo. Scritto dopo  La vegetariana  e definito dal­ la stessa autrice «quasi un suo lieto fine»,  L’ora di greco  si insinua − avvolto in un bozzolo di apparente semplicità − nella mente del lettore, come un «assurdo indimostra­bile», una voce limpida e familiare che ar­riva da un altro pianeta.",«Un romanzo eccelso che diventa più profondo a ogni lettura» («The Guardian»).,Han Kang,Atti umani,La pagina più cruenta del recente passato coreano in un romanzo implacabile.,"gli Adelphi, 666",2023 / pp. 205 /,"€ 12,00","€ 9,60","€ 19,00",Convalescenza,"Piccola Biblioteca Adelphi, 739",2019 / pp. 86 /,"€ 11,00","€ 8,80","Lawrence Osborne   Java Road   Cosa faresti se il tuo più vecchio amico
fosse un assassino, ma non ne avessi le
prove?              Benjamín Labatut   Maniac   L’odissea nera di John von Neumann, l’uomo che disegnò la mappa infernale del mondo che oggi abitiamo, nel nuovo straordinario libro di Benjamín Labatut.              Ian Fleming   Al servizio segreto di Sua Maestà   Uno dei più celebri, e rapinosi, capitoli delle avventure di James Bond.                  Michael Bible   L’ultima cosa bella sulla faccia della terra   «Un pugno nello stomaco» («New York Times Book Review»).              Pierre Boileau, Thomas Narcejac   I volti dell’ombra   Una lenta, inesorabile discesa nell’incubo.              Jean Stafford   Il puma   Una grande scrittrice che attende ancora di essere scoperta.                  Inès Cagnati   Giorno di vacanza   Il dolore delle origini in un romanzo di insolente intensità.              Peter Cameron   Che cosa fa la gente tutto il giorno?   I moti infinitesimali del nostro animo svelati dal Cameron più penetrante.              Christopher Isherwood   Il mondo di sera   Isherwood al massimo del suo estro narrativo."
Inferno. Leggende - Giacobbe lotta - August Strindberg,Inferno,August Strindberg,"A cura e con un saggio di Luciano Codignola    gli Adelphi  , 675   2023, pp. 459   isbn: 9788845938221","€ 15,00","€ 14,25",national library of sweden,Quaderni         Letterature scandinave,1972 / pp. 444 /,"€ 25,00","La vita di Strindberg fu una successione di cataclismi: il più brutale, il più irriducibilmente strindberghiano fu quello del 1895, quando, a Parigi, la ‘mano dell’invisibile’ lo precipitò in un’esperienza dissestante, introducendolo a terribili cieli e inferni, retti da quelle ‘potenze sconosciute’ che Strindberg riuscì poi, a sua volta, a introdurre in un romanzo-diario. Scritto di getto, come una stenografia visionaria,  Inferno  risponde tuttavia a un piano cifrato che difficilmente riesce a cogliere chi legga, anziché l’intera trilogia, solo la prima parte, l’unica che si usa pubblicare. Che cos’è l’  Inferno  di Strindberg? È, in primo luogo, quello che Swedenborg aveva descritto in tante sue opere e che ora Strindberg riconosce in ogni particolare per le vie del Quartier Latin, come una lugubre messa in scena finalmente svelata. Ma non è solo questo: attore principale in una portentosa macchinazione, Strindberg ci appare qui al tempo stesso come l’alchimista delirante che in squallide stanze d’albergo trasforma il piombo in oro; come l’uomo dello ‘scetticismo illuminato’, che ha superato ogni illusione; come il primo scrittore moderno che fa confluire fisiologia, psicologia e parapsicologia; come l’aruspice per cui ogni coincidenza è una ‘corrispondenza’.","«Tra i miei lettori ho un autentico genio, lo svedese August Strindberg» (Friedrich Nietzsche a Meta von Salis, 29 dicembre 1888).",August Strindberg,L’arringa di un pazzo,Il rapporto fra i sessi narrato e anatomizzato come un’atroce lotta per la sopraffazione.,"Biblioteca Adelphi, 657",2016 / pp. 284 /,"€ 19,00","€ 15,20","€ 10,99",Teatro da camera,"Piccola Biblioteca Adelphi, 98",1980 / pp. 280 /,"€ 18,00","€ 14,40","Ingeborg Bachmann   Il libro Franza   «Anzi io affermo – e tenterò soltanto di fornire una prima prova – che ancora oggi moltissime persone non muoiono ma vengono assassinate».              Daisetz T. Suzuki   Lo Zen e la cultura giapponese   La migliore guida per avvicinarsi al Giappone.              Alfred Polgar   Marlene   La sola attrice capace di «far sognare il nostro sangue nelle vene».                  Kenneth Anger   Hollywood Babilonia, II   «... un universo splendido e crudelissimo, mistura di paradiso e inferno, di lustrini e di lacrime, di successo e di abiezione» (Giovanni Mariotti).              Georges Simenon   Gli altri   Un suicidio inspiegabile, un’eredità contesa, una famiglia dilaniata da antichi dissapori – sotto lo sguardo inclemente di un’intera città.              Igor’ Stravinskij, Robert Craft   Ricordi e commenti   Vita, incontri, pensieri del grande  sorcier  del Novecento musicale.                  Milan Kundera   L’arte del romanzo   «... il romanziere non è né uno storico, né un profeta: è un esploratore dell’esistenza» (Milan Kundera).              Katherine Mansfield   Qualcosa di infantile ma di molto naturale   «La sola scrittura di cui sia mai stata invidiosa» (Virginia Woolf).              Sam Kean   La Brigata dei bastardi   L’avvincente racconto di una missione bellico-scientifica tanto misconosciuta quanto decisiva."
I viaggi la morte - Carlo Emilio Gadda,I viaggi la morte,Carlo Emilio Gadda,"A cura di Mariarosa Bricchi    Biblioteca Adelphi  , 751   2023, pp. 423   isbn: 9788845938078","€ 24,00","€ 22,80",tokyo fuji art museum / bridgeman images,Letteratura italiana         Critica e storia letteraria         Prose saggistiche,,,"Presentando nel 1958 gli scritti che compongono  I viaggi la morte  , Gadda suggeriva che, in luogo del comune «saggi», sarebbe forse stato preferibile per definirli il francese  entretiens  , ‘conversazioni’. Con questa discreta indicazione l’ormai celebre autore del  Pasticciaccio  rivendicava l’estraneità del libro alla «nostra coltura solidificata», e insieme ammantava di rassicurante affabilità la sua vera natura e la missione di cui era investito. Che era quella – come confidava a Livio Garzanti – di delineare il «panorama général» della sua «sindrome», abbracciando un’intera vita e tutta la gamma dei suoi interessi: di consegnare insomma ai nuovi fan una bussola per orientarsi nella più vertiginosa officina del Novecento e comprenderne le leggi. Leggi radicate in una riflessione filosofica che impone la demolizione del mito dello scrittore come vate o profeta, «bambolotto della credulità tolemaica», mentre l’io rappresentatore è un «groppo, o nodo, o groviglio, di rapporti fisici e metafisici» e solo dalla «tensione polare» con la cosa rappresentata nasce l’atto espressivo; e che nella maccheronea o «tumescenza barocca» individua un’arma letale, capace di annientare vaniloquio e falsità, enfasi e «teatrati atteggiamenti», nonché di contrastare l’«uso-Cesira», la lingua piccolo-borghese, «piccoletto grembiule casalingo da rigovernare le stoviglie». Se dunque Gadda, «bracconiere di frodo», fa razzia di varianti lessicali e ortoepiche, se ricorre al frasario gergale dei pratici e ai dialetti – da quello irresistibilmente sincopato e monosillabico dell’industre Milano alla parlata di Roma, «città mondo» – è nel nome di un’esigenza etica e gnoseologica: riscattare la lingua «dall’ossessione della frode» e ricreare la «magìa della verità».",«... riverisco i vati: non lavoro come i vati: lavoro come i non vati» (C.E. Gadda).,Carlo Emilio Gadda,Quer pasticciaccio brutto de via Merulana,"«… il più assoluto “giallo” che sia mai stato scritto, un “giallo” senza soluzione, un  pasticciaccio  »  (Leonardo Sciascia).","gli Adelphi, 660",2023 / pp. 370 /,"€ 14,00","€ 11,20","€ 22,00      € 17,60",La casa dei ricchi,"Microgrammi, 2",2020 / pp. 87 /,"€ 5,00","€ 4,00",
Kabloona. L’uomo bianco - Gontran de Poncins,Kabloona,Gontran de Poncins,"Disegni e fotografie dell’Autore   Con la collaborazione di Lewis Galantière   Traduzione di Marco Rossari    Biblioteca Adelphi  , 753   2023, pp. 332   isbn: 9788845938290","€ 24,00","€ 22,80",,Antropologia         Letteratura di viaggi         Reportage,2023 / pp. 332 /,"€ 19,49","Nel 1938 un visconte francese avventuroso e un po’ avventuriero, sempre alla ricerca di un senso da dare alla vita, decide di partire per l’estremo Nord, al di là del Canada, dove vivono le popolazioni più «primitive». Nel racconto di questa esperienza – una lenta e progressiva acclimatazione, in ogni senso, al nuovo mondo – tutto incanta fin dal primo istante: le durissime prove di resistenza, l’asprezza degli elementi, descritti con una vivacità e un’immediatezza fuori del comune, ma sopra ogni altra cosa l’incontro con gli  Inuit  , i più arcaici abitanti dell’Artico. Dapprima irrigidito nella sua supremazia di  Kabloona  , «uomo bianco» – si spingerà a dire che gli  Inuit  «non pensano», il che secondo i nostri angusti canoni potrebbe sembrare vero –, Gontran de Poncins finirà per imparare molto da queste genti, che non si pongono affatto il problema di dare un senso alla vita, come scopriremo in pagine profonde, spiazzanti, educative nel senso più alto della parola. E nell’ora sofferta del ritorno, si renderà conto, inaspettatamente, di essere diventato  uno di loro  . Il suo cuore rimarrà lì, come quello di noi lettori, illuminati da un’avventura che, superando ogni distanza, riesce a farci entrare nell’anima di un popolo e di un tempo che non potranno essere più.",L’avventura impossibile di un aristocratico francese nel mondo aspro e arcaico degli inuit,,,,,,,,,,,,,,
Un romanzo russo - Emmanuel Carrère,Un romanzo russo,Emmanuel Carrère,"Traduzione di Lorenza Di Lella e Maria Laura Vanorio    gli Adelphi  , 672   2023, pp. 283   isbn: 9788845938214","€ 13,00","€ 12,35",evgenia arbugaeva,Letteratura francese         Autobiografie         Storia contemporanea,2018 / pp. 283 /,"€ 19,00      € 15,20","«La follia e l’orrore hanno attanagliato la mia vita» scriveva Carrère presentando  Un romanzo russo  ai lettori francesi. Un giorno, però, dopo aver concluso la stesura dell’  Avversario  , alla follia e all’orrore decide di sfuggire. Trova un nuovo amore e accetta di realizzare un reportage su un prigioniero di guerra ungherese dimenticato per più di cinquant’anni in un ospedale psichiatrico russo. Arriva così in una cittadina a ottocento chilometri da Mosca, dove tornerà poi una seconda volta, ad aspettare, quasi in agguato, che accada qualcosa. Qualcosa accadrà: un delitto atroce. La follia e l’orrore l’hanno dunque «riagguantato». Anche nella vita amorosa: un racconto erotico scritto per gioco, per «fare irruzione nel reale», precipita lui e la sua compagna in un incubo destinato a devastare le loro vite. Nel frattempo, il viaggio in Russia ha messo fatalmente in gioco le sue origini e il suo rapporto con la lingua della madre – e Carrère comincia a indagare su quello che gli «è stato proibito raccontare»: «il fantasma che ossessiona la nostra famiglia». Per esorcizzare quel fantasma compirà «un oscuro percorso nell’inconscio di due generazioni», che lo porterà alla resa dei conti con un retaggio «di paura e di vergogna».","Il «romanzo familiare» di Carrère – quello in cui, intrecciando generi e fili narrativi diversi, l’autore fa i conti con un retaggio «di paura e di vergogna».",Emmanuel Carrère,V13,"Un viaggio al termine dell’orrore e della pietà raccontato con lucida empatia, senza un’ombra di enfasi o di lirismo, dall’autore dell’  Avversario  .","La collana dei casi, 147",2023 / pp. 267 /,"€ 20,00","€ 16,00","€ 10,99",La settimana bianca,"gli Adelphi, 618",2021 / pp. 139 /,"€ 12,00","€ 9,60","Ingeborg Bachmann   Il libro Franza   «Anzi io affermo – e tenterò soltanto di fornire una prima prova – che ancora oggi moltissime persone non muoiono ma vengono assassinate».              Daisetz T. Suzuki   Lo Zen e la cultura giapponese   La migliore guida per avvicinarsi al Giappone.              Alfred Polgar   Marlene   La sola attrice capace di «far sognare il nostro sangue nelle vene».                  Kenneth Anger   Hollywood Babilonia, II   «... un universo splendido e crudelissimo, mistura di paradiso e inferno, di lustrini e di lacrime, di successo e di abiezione» (Giovanni Mariotti).              Georges Simenon   Gli altri   Un suicidio inspiegabile, un’eredità contesa, una famiglia dilaniata da antichi dissapori – sotto lo sguardo inclemente di un’intera città.              Igor’ Stravinskij, Robert Craft   Ricordi e commenti   Vita, incontri, pensieri del grande  sorcier  del Novecento musicale.                  Milan Kundera   L’arte del romanzo   «... il romanziere non è né uno storico, né un profeta: è un esploratore dell’esistenza» (Milan Kundera).              Katherine Mansfield   Qualcosa di infantile ma di molto naturale   «La sola scrittura di cui sia mai stata invidiosa» (Virginia Woolf).              Sam Kean   La Brigata dei bastardi   L’avvincente racconto di una missione bellico-scientifica tanto misconosciuta quanto decisiva."
Il viaggio della tartaruga - Carl Safina,Il viaggio della tartaruga,Carl Safina,"Traduzione di Isabella C. Blum    Animalia  , 11   2023, pp. 623   isbn: 9788845938351","€ 32,00","€ 30,40",jorge hauser,Etologia,2023 / pp. 623 /,"€ 16,99","«Esiste una presenza, nell’oceano, che raramente cogli nelle ore di veglia, e che visualizzi meglio nei sogni. Mentre scivoli nel sonno, le tartarughe cavalcano la curva degli abissi, cercando respiro in superficie e ispirazione dal cielo». Fin dal rapinoso incipit melvilliano, il libro che Carl Safina ha dedicato alle tartarughe, osservandole e studiandole per anni in ogni mare e oceano, si rivela molto più di un trattato biologico-etologico. È una lunga, serrata narrazione visionaria, dove sin dalle prime pagine emerge una protagonista indiscussa, vera guida del viaggio: la Tartaruga Liuto, a un tempo l’esemplare più grande del suo ordine (può sfiorare la tonnellata) e tra quelli più antichi sotto il profilo evolutivo, che fa di lei «l’ultimo dinosauro» sulla Terra. Seguendo «il Leviatano delle tartarughe» nei suoi vertiginosi tragitti migratori – strappi anche di sedicimila chilometri, che riflettono una distribuzione amplissima, dai mari equatoriali alle acque artico-antartiche – Safina ne descrive le sorprendenti caratteristiche: morfologiche, a partire dal guscio «molle» a mosaico; anatomiche, in particolare il complesso sistema cardiovascolare, che armonizza polmoni piccoli e un cuore gigantesco da un battito al minuto; cognitivo-comportamentali, giacché l’intricata routine della stagione riproduttiva è guidata dall’attività ormonale e da un «riuscitissimo cervello da neanche novanta grammi». E alla fine, attraverso una prosa piena di incanto – ben più potente di ogni invettiva morale –, riesce ad elevare via via la sua ricerca ad appassionato memento ecologico: basterebbero le sequenze sulle Liuto uccise dalle plastiche (scambiate per meduse) o sui loro carapaci scheggiati dai machete dei pescatori, per cogliere nella cecità ambientale del  Sapiens  un ritratto spietato e dolente della sua (auto)distruttività.",Il «Leviatano delle tartarughe» in uno studio che è anche una narrazione travolgente.,Carl Safina,Animali non umani,"Famiglia, bellezza e pace nelle culture animali.","Animalia, 9",2022 / pp. 565 /,"€ 30,00","€ 24,00","€ 13,99",Al di là delle parole,"Animalia, 1",2018 / pp. 687 /,"€ 34,00","€ 27,20","Len Howard   Star   Gli studi pionieristici che hanno cambiato la storia dell’ornitologia.              Carl Safina   Animali non umani   Famiglia, bellezza e pace nelle culture animali.              Lee Alan Dugatkin, Ljudmila Trut   Come addomesticare una volpe   «Una storia che in parte è scienza, in parte fiaba russa, e in parte thriller di spionaggio».   («New York Times»)                  Peter Godfrey-Smith   Metazoa   Peter Godfrey-Smith scrive e pensa come nessun altro che io conosca. È un palombaro immerso nella scienza della vita e  Metazoa  è la sua più profonda immersione (Carl Safina).              Giorgio Vallortigara   Pensieri della mosca con la testa storta   Un approccio minimalista che apre nuove prospettive allo studio della coscienza.              Bert Hölldobler, Edward O. Wilson   Le formiche tagliafoglie   «Una formica, da sola, non è una formica» (Edward O. Wilson).                  Richard O. Prum   L’evoluzione della bellezza   La sopravvivenza dei più belli – l’evoluzione come non è mai stata raccontata.              Bernd Heinrich   La mente del corvo   E l’uomo incontrò il corvo.              Peter Godfrey-Smith   Altre menti   «Affascinante e spesso delizioso» («The Times»)."
L’ultima cosa bella sulla faccia della terra - Michael Bible,L’ultima cosa bella sulla faccia della terra,Michael Bible,"Traduzione di Martina Testa    Fabula  , 393   2023, 5ª ediz., pp. 135   isbn: 9788845938115","€ 16,00","€ 15,20",david de las heras,Letteratura nordamericana,2023 / pp. 135 /,"€ 9,99",,«Un pugno nello stomaco» («New York Times Book Review»).,,,,,,,,,,,,,,"Lawrence Osborne   Java Road   Cosa faresti se il tuo più vecchio amico
fosse un assassino, ma non ne avessi le
prove?              Han Kang   L’ora di greco   «Un romanzo eccelso che diventa più profondo a ogni lettura» («The Guardian»).              Benjamín Labatut   Maniac   L’odissea nera di John von Neumann, l’uomo che disegnò la mappa infernale del mondo che oggi abitiamo, nel nuovo straordinario libro di Benjamín Labatut.                  Ian Fleming   Al servizio segreto di Sua Maestà   Uno dei più celebri, e rapinosi, capitoli delle avventure di James Bond.              Pierre Boileau, Thomas Narcejac   I volti dell’ombra   Una lenta, inesorabile discesa nell’incubo.              Jean Stafford   Il puma   Una grande scrittrice che attende ancora di essere scoperta.                  Inès Cagnati   Giorno di vacanza   Il dolore delle origini in un romanzo di insolente intensità.              Peter Cameron   Che cosa fa la gente tutto il giorno?   I moti infinitesimali del nostro animo svelati dal Cameron più penetrante.              Christopher Isherwood   Il mondo di sera   Isherwood al massimo del suo estro narrativo."
